{
  "$schema": "https://json-schema.org/draft/2020-12/schema",
  "$id": "https://playuni.app/contract/schemas/mod.schema.json",
  "title": "Mod manifest (mod.json)",
  "description": "One mod folder's manifest. The folder name is a suggested id, the manifest id is authoritative. Metadata only; content lives in entry-set directories (cards/, rules/, statuses/, mutations/, decks/, assets/, tables/, entities/, presentations/) auto-detected by the loader.",
  "type": "object",
  "required": ["id", "name", "version", "api"],
  "additionalProperties": true,
  "properties": {
    "id": {
      "type": "string",
      "pattern": "^[a-z0-9_]{1,32}$",
      "description": "Globally unique namespace across the mods folder."
    },
    "name": {
      "type": "string",
      "minLength": 1
    },
    "version": {
      "type": "string",
      "minLength": 1,
      "description": "Semver of the content, not the schema."
    },
    "api": {
      "type": "string",
      "pattern": "^[0-9]+$",
      "description": "Schema/contract version this content targets. A mod targeting api N > engine api is rejected."
    },
    "description": {
      "type": "string"
    },
    "author": {
      "type": "string"
    },
    "dev_only": {
      "type": "boolean",
      "description": "When true the loader omits this mod from production builds (UNI_PROD_BUILD or UNI_ENV=production)."
    },
    "settings": {
      "type": "array",
      "description": "Named settings this mod declares, validated against deck settings values.",
      "items": {
        "type": "object",
        "required": ["id", "type"],
        "additionalProperties": true,
        "properties": {
          "id": {
            "type": "string",
            "pattern": "^[a-z0-9_]{1,32}$"
          },
          "type": {
            "type": "string",
            "enum": ["int", "number", "bool", "string"]
          },
          "default": {},
          "range": {},
          "description": {
            "type": "string"
          }
        }
      }
    },
    "prompts": {
      "type": "array",
      "description": "Prompt kinds this mod declares (prompt envelope vocabulary)."
    },
    "signals": {
      "type": "array",
      "description": "Named signals this mod may emit via emit_signal."
    }
  }
}
